{
  "schemaVersion": 2,
  "contentRevision": "ws-content-r2",
  "domain": "fixture-draw-locks",
  "records": [
    {
      "id": "DRAW-PERSONAL-L3",
      "sourceDocumentId": "AUG-LIST-001",
      "enabled": true,
      "scope": "PERSONAL",
      "milestone": 3,
      "trigger": "LEVEL_REACHED",
      "tierPolicy": "SILVER",
      "choiceCount": 3,
      "selectionCount": 1,
      "returnToSlotZero": true,
      "sharedTierLock": false
    },
    {
      "id": "DRAW-PERSONAL-L6",
      "sourceDocumentId": "AUG-LIST-001",
      "enabled": true,
      "scope": "PERSONAL",
      "milestone": 6,
      "trigger": "LEVEL_REACHED",
      "tierPolicy": "GOLD",
      "choiceCount": 3,
      "selectionCount": 1,
      "returnToSlotZero": true,
      "sharedTierLock": false
    },
    {
      "id": "DRAW-PERSONAL-L10",
      "sourceDocumentId": "AUG-LIST-001",
      "enabled": true,
      "scope": "PERSONAL",
      "milestone": 10,
      "trigger": "LEVEL_REACHED",
      "tierPolicy": "PRISM",
      "choiceCount": 3,
      "selectionCount": 1,
      "returnToSlotZero": true,
      "sharedTierLock": false
    },
    {
      "id": "DRAW-PERSONAL-L15",
      "sourceDocumentId": "AUG-LIST-001",
      "enabled": true,
      "scope": "PERSONAL",
      "milestone": 15,
      "trigger": "LEVEL_REACHED",
      "tierPolicy": "FIRST_ACHIEVER_RANDOM_50_30_20",
      "choiceCount": 3,
      "selectionCount": 1,
      "returnToSlotZero": true,
      "sharedTierLock": true
    },
    {
      "id": "DRAW-PERSONAL-L20",
      "sourceDocumentId": "AUG-LIST-001",
      "enabled": true,
      "scope": "PERSONAL",
      "milestone": 20,
      "trigger": "LEVEL_REACHED",
      "tierPolicy": "FIRST_ACHIEVER_RANDOM_50_30_20",
      "choiceCount": 3,
      "selectionCount": 1,
      "returnToSlotZero": true,
      "sharedTierLock": true
    },
    {
      "id": "DRAW-PERSONAL-L25",
      "sourceDocumentId": "AUG-LIST-001",
      "enabled": true,
      "scope": "PERSONAL",
      "milestone": 25,
      "trigger": "LEVEL_REACHED",
      "tierPolicy": "FIRST_ACHIEVER_RANDOM_50_30_20",
      "choiceCount": 3,
      "selectionCount": 1,
      "returnToSlotZero": true,
      "sharedTierLock": true
    },
    {
      "id": "DRAW-PERSONAL-L30",
      "sourceDocumentId": "AUG-LIST-001",
      "enabled": true,
      "scope": "PERSONAL",
      "milestone": 30,
      "trigger": "LEVEL_REACHED",
      "tierPolicy": "FIRST_ACHIEVER_RANDOM_50_30_20",
      "choiceCount": 3,
      "selectionCount": 1,
      "returnToSlotZero": true,
      "sharedTierLock": true
    },
    {
      "id": "DRAW-PERSONAL-L35",
      "sourceDocumentId": "AUG-LIST-001",
      "enabled": true,
      "scope": "PERSONAL",
      "milestone": 35,
      "trigger": "LEVEL_REACHED",
      "tierPolicy": "FIRST_ACHIEVER_RANDOM_50_30_20",
      "choiceCount": 3,
      "selectionCount": 1,
      "returnToSlotZero": true,
      "sharedTierLock": true
    },
    {
      "id": "DRAW-PERSONAL-L40",
      "sourceDocumentId": "AUG-LIST-001",
      "enabled": true,
      "scope": "PERSONAL",
      "milestone": 40,
      "trigger": "LEVEL_REACHED",
      "tierPolicy": "FIRST_ACHIEVER_RANDOM_50_30_20",
      "choiceCount": 3,
      "selectionCount": 1,
      "returnToSlotZero": true,
      "sharedTierLock": true
    },
    {
      "id": "DRAW-PERSONAL-L45",
      "sourceDocumentId": "AUG-LIST-001",
      "enabled": true,
      "scope": "PERSONAL",
      "milestone": 45,
      "trigger": "LEVEL_REACHED",
      "tierPolicy": "FIRST_ACHIEVER_RANDOM_50_30_20",
      "choiceCount": 3,
      "selectionCount": 1,
      "returnToSlotZero": true,
      "sharedTierLock": true
    },
    {
      "id": "DRAW-PARTY-D10",
      "sourceDocumentId": "AUG-LIST-002",
      "enabled": true,
      "scope": "PARTY",
      "milestone": 10,
      "trigger": "BOSS-D10-DEFEATED",
      "tierPolicy": "PARTY_POOL",
      "choiceCount": 3,
      "selectionCount": 1,
      "returnToSlotZero": false,
      "sharedTierLock": true
    },
    {
      "id": "DRAW-PARTY-D20",
      "sourceDocumentId": "AUG-LIST-002",
      "enabled": true,
      "scope": "PARTY",
      "milestone": 20,
      "trigger": "BOSS-D20-DEFEATED",
      "tierPolicy": "PARTY_POOL",
      "choiceCount": 3,
      "selectionCount": 1,
      "returnToSlotZero": false,
      "sharedTierLock": true
    },
    {
      "id": "DRAW-PARTY-D30",
      "sourceDocumentId": "AUG-LIST-002",
      "enabled": true,
      "scope": "PARTY",
      "milestone": 30,
      "trigger": "BOSS-D30-DEFEATED",
      "tierPolicy": "PARTY_POOL",
      "choiceCount": 3,
      "selectionCount": 1,
      "returnToSlotZero": false,
      "sharedTierLock": true
    },
    {
      "id": "DRAW-PARTY-D40",
      "sourceDocumentId": "AUG-LIST-002",
      "enabled": true,
      "scope": "PARTY",
      "milestone": 40,
      "trigger": "BOSS-D40-DEFEATED",
      "tierPolicy": "PARTY_POOL",
      "choiceCount": 3,
      "selectionCount": 1,
      "returnToSlotZero": false,
      "sharedTierLock": true
    }
  ]
}
